query,positive_doc,negative_doc,positive_case_id,negative_case_id
ما هو الحكم الصادر ضد شركة (...) التجارية لصالح شركة (...) للتجارة المحدودة بشأن المبلغ المالي المستحق؟,"مة الإدارية بحائل الصادر بتاريخ ٢٤/١١/١٤٣٨ه في القضية رقم ٦٦٥/٨/ق لعام ١٤٣٨ه القاضي بإلزام شركة (...) التجارية سجل تجاري رقم (...) بأن تدفع لشركة (...) للتجارة المحدودة سجل تجاري رقم (...) مبلغاً قدره  (٣٧.٨٧٦) سبعة وثلاثون ألفاً وثمانمائة وستة وسبعون ريالاً. محمولاً على أسبابه الموضوعية. والله الموفق. وصلى الله وسلم على نبينا محمد وعلى أله وصحبه أجمعين
نايف بن عبدالله الحايك     	                      أمين السر
د. عبدالعزيز بن عبدالعزيز الشثري                    عضو
ناصر بن حمد الوهيبي         ",ليها المثبت في ضبط الجلسة هويته ومستند صفته، ثم سألت الدائرة ممثل المدعية عن دعواه فعرضها كما جاء في لائحة الدعوى، وبعرض ذلك على وكيل المدعى عليها قدم مذكرة من ورقة واحدة تضمنت دفع موكلته بعدم اختصاص المحكمة مكانياً في نظر الدعوى لكون المدعى عليها يقع مقرها في مدينة عنيزة بمنطقة القصيم، كما أن المشروع محل العقد يقع في نفس المدينة. وقد أرفق مع مذكرته إثباتاً لدفعه صورة من العقد المؤرخ في١٣/٧/١٤٣٦هـ، وصورة من شهادة السجل التجاري للمدعى عليها برقم (...) وتاريخ٣/٥/١٣٨٨، وصورة شهادة السجل التجاري لفر,13093,13066
ما هي الأسباب الموضوعية التي استندت إليها المحكمة في إلزام دفع مبلغ ٤٨.٦٤١ ريال لشركة (...) للتجارة والمقاولات؟,"...) بأن يدفع لشركة (...) للتجارة والمقاولات سجل تجاري رقم (...) مبلغاً قدره  ( ٤٨.٦٤١ ) ثمان وأربعون ألف وتسعمائة وواحد وأربعون ريالاً . محمولاً على أسبابه الموضوعية . والله الموفق . وصلى الله وسلم على نبينا محمد وعلى أله وصحبه أجمعين
مهند بن سلمان العبدلي	                                  أمين السر
ناصر بن حمد الوهيبي	                                        عضو
بديع بن سعود البديع                                        عضو
عبدالرحمن بن محمد الجوفان                   رئيس الدائرة","(٧٠٠.٠٠٠) بموجب شيك أرفقت صورته في ملف الدعوى، وذلك قيمة أرض كان موكله قد باعها للمدعى عليه، ولم يتم سداد المبلغ المستحق، وأن موكل المدعي يطلب إلزام المدعى عليه بالسداد. وبإحالة القضية للدائرة أجرت ما هو لازم لنظرها وفي جلسة هذا اليوم حضر وكيل المدعي، وبسؤاله عن دعوى موكله أحال على ما ورد في لائحة الدعوى، وبسؤال الدائرة وكيل المدعي عن ملكية العقار أجاب بأن ملكية العقار تعود إلى موكله، وعليه أقفل المحضر.
الأسباب:
لما كانت مسألة الاختصاص من المسائل التي يتعين على الدائرة بحثها والفصل فيها ابتداءً ",13084,13051
ما هي تفاصيل الحكم الصادر من المحكمة الإدارية بتبوك في القضية المتعلقة بالبيع العقاري واستحقاق العقار؟,"الحكم الصادر في القضية رقم ١٠٣٤/١٣/ق لعام ١٤٣٨هـــ
الحكم الصادر في القضية رقم ١٠٣٤/١٣/ق لعام ١٤٣٨هـــ
والمقامة من /   (...)
ضد / (...)
الحمد لله وحده، والصلاة والسلام على نبينا محمد وعلى آله وصحبه .. وبعده:
ففي هذا اليوم الاثنين الموافق ١٦/١٠/١٤٣٨هــ، وبمقر المحكمة الإدارية بتبوك؛عقدت الدائرة التجارية الأولى جلستها المشكلة من:
القاضي 	محمد بن عبد الله الزهراني       	رئيساً
القاضي	يوسف بن رايد السلمي		         عضواً
القاضي نايف بن سعود الربيش		        عضواً
وبحضور	عبد العزيز بن سليم الخمشي أمينا","الحكم في القضية رقم ٥١٨/٨/ق لعام ١٤٣٨ه
الحكم في القضية رقم ٥١٨/٨/ق لعام ١٤٣٨ه
المدعي / شركة (...)  للتجارة والمقاولات
المدعى عليه/(...)  صاحب مؤسسة مكتب  (...) للمقاولات
الحمد لله وحده ، والصلاة والسلام على نبينا محمد وآله وصحبه وبعد :
في هذا اليوم الاثنين الموافق ١٥/١١/١٤٣٨هـ عقدت الدائرة التجارية الأولى بمقرها بالمحكمة الإدارية بحائل جلستها  ، بتشكيلها المكون من  :
القاضي/ محمد بن حمد اليحياء                                رئيساً
القاضي / إبراهيم بن عبدالله العجلان                           عض",13051,13084
